{
  "schema_version": 1,
  "artifact_policy": "metadata-only: prompts and routing expectations only; no response bodies, transcripts, secrets, or rollout data",
  "sources": [
    "tests/skill-routing-cases.json",
    "benchmarks/core/behavioral-cases.json"
  ],
  "cases": [
    {
      "case_id": "routing-grill-me-1",
      "prompt": "Invoke the compatibility alias /grill-me command explicitly.",
      "expected_primary_skill": "grill-me",
      "acceptable_alternative_skills": [],
      "forbidden_skills": [],
      "case_kind": "positive",
      "source": "tests/skill-routing-cases.json",
      "source_case_id": "grill-me-1"
    },
    {
      "case_id": "routing-grill-me-2",
      "prompt": "Use the legacy compatibility alias /grill-me invocation explicitly.",
      "expected_primary_skill": "grill-me",
      "acceptable_alternative_skills": [],
      "forbidden_skills": [],
      "case_kind": "positive",
      "source": "tests/skill-routing-cases.json",
      "source_case_id": "grill-me-2"
    },
    {
      "case_id": "routing-grill-me-3",
      "prompt": "Explicitly invoke grill-me to challenge this plan.",
      "expected_primary_skill": "grill-me",
      "acceptable_alternative_skills": [],
      "forbidden_skills": [],
      "case_kind": "positive",
      "source": "tests/skill-routing-cases.json",
      "source_case_id": "grill-me-3"
    },
    {
      "case_id": "routing-grill-me-x1",
      "prompt": "Start a new interactive grilling session asking one recommended question at a time until shared understanding.",
      "expected_primary_skill": "grilling",
      "acceptable_alternative_skills": [],
      "forbidden_skills": [
        "grill-me"
      ],
      "case_kind": "exclusion",
      "source": "tests/skill-routing-cases.json",
      "source_case_id": "grill-me-x1",
      "group_id": "grill-me-vs-grilling"
    },
    {
      "case_id": "routing-grill-me-x2",
      "prompt": "Ask one question at a time until we understand the design.",
      "expected_primary_skill": "grilling",
      "acceptable_alternative_skills": [],
      "forbidden_skills": [
        "grill-me"
      ],
      "case_kind": "exclusion",
      "source": "tests/skill-routing-cases.json",
      "source_case_id": "grill-me-x2",
      "group_id": "grill-me-vs-grilling"
    },
    {
      "case_id": "routing-grilling-1",
      "prompt": "Stress-test this new plan interactively one question at a time.",
      "expected_primary_skill": "grilling",
      "acceptable_alternative_skills": [],
      "forbidden_skills": [],
      "case_kind": "positive",
      "source": "tests/skill-routing-cases.json",
      "source_case_id": "grilling-1"
    },
    {
      "case_id": "routing-grilling-2",
      "prompt": "Help me challenge this design until we share an understanding.",
      "expected_primary_skill": "grilling",
      "acceptable_alternative_skills": [],
      "forbidden_skills": [],
      "case_kind": "positive",
      "source": "tests/skill-routing-cases.json",
      "source_case_id": "grilling-2"
    },
    {
      "case_id": "routing-grilling-3",
      "prompt": "Begin a fresh interactive questioning session, asking one recommended question at a time until shared understanding.",
      "expected_primary_skill": "grilling",
      "acceptable_alternative_skills": [],
      "forbidden_skills": [],
      "case_kind": "positive",
      "source": "tests/skill-routing-cases.json",
      "source_case_id": "grilling-3"
    },
    {
      "case_id": "routing-grilling-x1",
      "prompt": "The user explicitly typed /grill-me.",
      "expected_primary_skill": "grill-me",
      "acceptable_alternative_skills": [],
      "forbidden_skills": [
        "grilling"
      ],
      "case_kind": "exclusion",
      "source": "tests/skill-routing-cases.json",
      "source_case_id": "grilling-x1",
      "group_id": "grill-me-vs-grilling"
    },
    {
      "case_id": "routing-grilling-x2",
      "prompt": "Use the legacy compatibility alias /grill-me command explicitly.",
      "expected_primary_skill": "grill-me",
      "acceptable_alternative_skills": [],
      "forbidden_skills": [
        "grilling"
      ],
      "case_kind": "exclusion",
      "source": "tests/skill-routing-cases.json",
      "source_case_id": "grilling-x2",
      "group_id": "grill-me-vs-grilling"
    },
    {
      "case_id": "routing-pr-review-1",
      "prompt": "Review pull request 42 and prepare merge-risk findings.",
      "expected_primary_skill": "pr-review",
      "acceptable_alternative_skills": [],
      "forbidden_skills": [],
      "case_kind": "positive",
      "source": "tests/skill-routing-cases.json",
      "source_case_id": "pr-review-1"
    },
    {
      "case_id": "routing-pr-review-2",
      "prompt": "Inspect this proposed merge and draft structured GitHub review comments.",
      "expected_primary_skill": "pr-review",
      "acceptable_alternative_skills": [],
      "forbidden_skills": [],
      "case_kind": "positive",
      "source": "tests/skill-routing-cases.json",
      "source_case_id": "pr-review-2"
    },
    {
      "case_id": "routing-pr-review-3",
      "prompt": "Review the pull request branch diff and prepare merge-risk findings before merging.",
      "expected_primary_skill": "pr-review",
      "acceptable_alternative_skills": [],
      "forbidden_skills": [],
      "case_kind": "positive",
      "source": "tests/skill-routing-cases.json",
      "source_case_id": "pr-review-3"
    },
    {
      "case_id": "routing-pr-review-x1",
      "prompt": "Another agent delegated a read-only review of uncommitted changes.",
      "expected_primary_skill": "review-agent",
      "acceptable_alternative_skills": [],
      "forbidden_skills": [
        "pr-review"
      ],
      "case_kind": "exclusion",
      "source": "tests/skill-routing-cases.json",
      "source_case_id": "pr-review-x1",
      "group_id": "pr-review-vs-review-agent"
    },
    {
      "case_id": "routing-pr-review-x2",
      "prompt": "Return defect findings for a commit without posting a PR review.",
      "expected_primary_skill": "review-agent",
      "acceptable_alternative_skills": [],
      "forbidden_skills": [
        "pr-review"
      ],
      "case_kind": "exclusion",
      "source": "tests/skill-routing-cases.json",
      "source_case_id": "pr-review-x2",
      "group_id": "pr-review-vs-review-agent"
    },
    {
      "case_id": "routing-review-agent-1",
      "prompt": "Perform a delegated read-only review of these uncommitted changes.",
      "expected_primary_skill": "review-agent",
      "acceptable_alternative_skills": [],
      "forbidden_skills": [],
      "case_kind": "positive",
      "source": "tests/skill-routing-cases.json",
      "source_case_id": "review-agent-1"
    },
    {
      "case_id": "routing-review-agent-2",
      "prompt": "Review this commit for every actionable defect.",
      "expected_primary_skill": "review-agent",
      "acceptable_alternative_skills": [],
      "forbidden_skills": [],
      "case_kind": "positive",
      "source": "tests/skill-routing-cases.json",
      "source_case_id": "review-agent-2"
    },
    {
      "case_id": "routing-review-agent-3",
      "prompt": "Inspect the base-branch diff under custom review instructions.",
      "expected_primary_skill": "review-agent",
      "acceptable_alternative_skills": [],
      "forbidden_skills": [],
      "case_kind": "positive",
      "source": "tests/skill-routing-cases.json",
      "source_case_id": "review-agent-3"
    },
    {
      "case_id": "routing-review-agent-x1",
      "prompt": "Review pull request 7 and prepare GitHub merge comments.",
      "expected_primary_skill": "pr-review",
      "acceptable_alternative_skills": [],
      "forbidden_skills": [
        "review-agent"
      ],
      "case_kind": "exclusion",
      "source": "tests/skill-routing-cases.json",
      "source_case_id": "review-agent-x1",
      "group_id": "pr-review-vs-review-agent"
    },
    {
      "case_id": "routing-review-agent-x2",
      "prompt": "Evaluate the proposed merge with merge-risk scoring.",
      "expected_primary_skill": "pr-review",
      "acceptable_alternative_skills": [],
      "forbidden_skills": [
        "review-agent"
      ],
      "case_kind": "exclusion",
      "source": "tests/skill-routing-cases.json",
      "source_case_id": "review-agent-x2",
      "group_id": "pr-review-vs-review-agent"
    },
    {
      "case_id": "routing-testing-qa-1",
      "prompt": "Choose proportionate unit and integration QA checks for this change.",
      "expected_primary_skill": "testing-qa",
      "acceptable_alternative_skills": [],
      "forbidden_skills": [],
      "case_kind": "positive",
      "source": "tests/skill-routing-cases.json",
      "source_case_id": "testing-qa-1"
    },
    {
      "case_id": "routing-testing-qa-2",
      "prompt": "Run browser, performance, and release-quality checks using existing tools.",
      "expected_primary_skill": "testing-qa",
      "acceptable_alternative_skills": [],
      "forbidden_skills": [],
      "case_kind": "positive",
      "source": "tests/skill-routing-cases.json",
      "source_case_id": "testing-qa-2"
    },
    {
      "case_id": "routing-testing-qa-3",
      "prompt": "Run browser, performance, security, and release QA for an existing change.",
      "expected_primary_skill": "testing-qa",
      "acceptable_alternative_skills": [],
      "forbidden_skills": [],
      "case_kind": "positive",
      "source": "tests/skill-routing-cases.json",
      "source_case_id": "testing-qa-3"
    },
    {
      "case_id": "routing-testing-qa-x1",
      "prompt": "Require a red-green-refactor cycle gated by local test results.",
      "expected_primary_skill": "test-driven-development",
      "acceptable_alternative_skills": [],
      "forbidden_skills": [
        "testing-qa"
      ],
      "case_kind": "exclusion",
      "source": "tests/skill-routing-cases.json",
      "source_case_id": "testing-qa-x1",